{
  "name": "blowhorn",
  "version": "0.1.1",
  "description": "Draft, queue and check social posts from your AI agent with Blowhorn's local MCP server on your Mac. Every state change is a dry run unless you confirm it.",
  "mcpServers": {
    "blowhorn": {
      "command": "node",
      "args": [
        "${extensionPath}${/}bin${/}blowhorn-mcp.js"
      ]
    }
  }
}
